authors,publicationDate,journal,volume,issue,pages,description
"Valery L Feigin, Emma Nichols, Tahiya Alam, Marlena S Bannick, Ettore Beghi, Natacha Blake, William J Culpepper, E Ray Dorsey, Alexis Elbaz, Richard G Ellenbogen, James L Fisher, Christina Fitzmaurice, Giorgia Giussani, Linda Glennie, Spencer L James, Catherine Owens Johnson, Nicholas J Kassebaum, Giancarlo Logroscino, Benoît Marin, W Cliff Mountjoy-Venning, Minh Nguyen, Richard Ofori-Asenso, Anoop P Patel, Marco Piccininni, Gregory A Roth, Timothy J Steiner, Lars Jacob Stovner, Cassandra EI Szoeke, Alice Theadom, Stein Emil Vollset, Mitchell Taylor Wallin, Claire Wright, Joseph Raymond Zunt, Nooshin Abbasi, Foad Abd-Allah, Ahmed Abdelalim, Ibrahim Abdollahpour, Victor Aboyans, Haftom Niguse Abraha, Dilaram Acharya, Abdu A Adamu, Oladimeji M Adebayo, Abiodun Moshood Adeoye, Jose C Adsuar, Mohsen Afarideh, Sutapa Agrawal, Alireza Ahmadi, Muktar Beshir Ahmed, Amani Nidhal Aichour, Ibtihel Aichour, Miloud Taki Eddine Aichour, Rufus Olusola Akinyemi, Nadia Akseer, Ayman Al-Eyadhy, Rustam Al-Shahi Salman, Fares Alahdab, Kefyalew Addis Alene, Syed Mohamed Aljunid, Khalid Altirkawi, Nelson Alvis-Guzman, Nahla Hamed Anber, Carl Abelardo T Antonio, Jalal Arabloo, Olatunde Aremu, Johan Ärnlöv, Hamid Asayesh, Rana Jawad Asghar, Hagos Tasew Atalay, Ashish Awasthi, Beatriz Paulina Ayala Quintanilla, Tambe B Ayuk, Alaa Badawi, Maciej Banach, Joseph Adel Mattar Banoub, Miguel A Barboza, Suzanne Lyn Barker-Collo, Till Winfried Bärnighausen, Bernhard T Baune, Neeraj Bedi, Masoud Behzadifar, Meysam Behzadifar, Yannick Bejot, Bayu Begashaw Bekele, Abate Bekele Belachew, Derrick A Bennett, Isabela M Bensenor, Adugnaw Berhane, Mircea Beuran, Krittika Bhattacharyya, Zulfiqar A Bhutta, Belete Biadgo, Ali Bijani, Nigus Bililign, Muhammad Shahdaat Bin Sayeed, Christopher Kynrint Blazes, Carol Brayne, Zahid A Butt, Ismael R Campos-Nonato, Carlos Cantu-Brito, Mate Car, Rosario Cárdenas, Juan J Carrero, Félix Carvalho, Carlos A Castañeda-Orjuela, Franz Castro, Ferrán Catalá-López, Ester Cerin, Yazan Chaiah, Jung-Chen Chang, Irini Chatziralli, Peggy Pei-Chia Chiang, Hanne Christensen, Devasahayam J Christopher, Cyrus Cooper, Paolo Angelo Cortesi, Vera M Costa, Michael H Criqui, Christopher Stephen Crowe, Albertino Antonio Moura Damasceno, Ahmad Daryani, Vanessa De la Cruz-Góngora, Fernando Pio De la Hoz, Diego De Leo, Gebre Teklemariam Demoz, Kebede Deribe, Samath Dhamminda Dharmaratne, Daniel Diaz, Mesfin Tadese Dinberu, Shirin Djalalinia, David Teye Doku, Manisha Dubey, Eleonora Dubljanin, Eyasu Ejeta Duken, David Edvardsson, Ziad El-Khatib, Matthias Endres, Aman Yesuf Endries, Sharareh Eskandarieh, Alireza Esteghamati, Sadaf Esteghamati, Farzaneh Farhadi, Andre Faro, Farshad Farzadfar, Mohammad Hosein Farzaei, Batool Fatima, Seyed-Mohammad Fereshtehnejad, Eduarda Fernandes, Garumma Tolu Feyissa, Irina Filip, Florian Fischer",2019/5/1,The Lancet Neurology,18,5,459-480,Elsevier
"Boris Bikbov, Caroline A Purcell, Andrew S Levey, Mari Smith, Amir Abdoli, Molla Abebe, Oladimeji M Adebayo, Mohsen Afarideh, Sanjay Kumar Agarwal, Marcela Agudelo-Botero, Elham Ahmadian, Ziyad Al-Aly, Vahid Alipour, Amir Almasi-Hashiani, Rajaa M Al-Raddadi, Nelson Alvis-Guzman, Saeed Amini, Tudorel Andrei, Catalina Liliana Andrei, Zewudu Andualem, Mina Anjomshoa, Jalal Arabloo, Alebachew Fasil Ashagre, Daniel Asmelash, Zerihun Ataro, Maha Moh'd Wahbi Atout, Martin Amogre Ayanore, Alaa Badawi, Ahad Bakhtiari, Shoshana H Ballew, Abbas Balouchi, Maciej Banach, Simon Barquera, Sanjay Basu, Mulat Tirfie Bayih, Neeraj Bedi, Aminu K Bello, Isabela M Bensenor, Ali Bijani, Archith Boloor, Antonio M Borzì, Luis Alberto Cámera, Juan J Carrero, Félix Carvalho, Franz Castro, Ferrán Catalá-López, Alex R Chang, Ken Lee Chin, Sheng-Chia Chung, Massimo Cirillo, Ewerton Cousin, Lalit Dandona, Rakhi Dandona, Ahmad Daryani, Rajat Das Gupta, Feleke Mekonnen Demeke, Gebre Teklemariam Demoz, Desilu Mahari Desta, Huyen Phuc Do, Bruce B Duncan, Aziz Eftekhari, Alireza Esteghamati, Syeda Sadia Fatima, João C Fernandes, Eduarda Fernandes, Florian Fischer, Marisa Freitas, Mohamed M Gad, Gebreamlak Gebremedhn Gebremeskel, Begashaw Melaku Gebresillassie, Birhanu Geta, Mansour Ghafourifard, Alireza Ghajar, Nermin Ghith, Paramjit Singh Gill, Ibrahim Abdelmageed Ginawi, Rajeev Gupta, Nima Hafezi-Nejad, Arvin Haj-Mirzaian, Arya Haj-Mirzaian, Ninuk Hariyani, Mehedi Hasan, Milad Hasankhani, Amir Hasanzadeh, Hamid Yimam Hassen, Simon I Hay, Behnam Heidari, Claudiu Herteliu, Chi Linh Hoang, Mostafa Hosseini, Mihaela Hostiuc, Seyed Sina Naghibi Irvani, Sheikh Mohammed Shariful Islam, Nader Jafari Balalami, Spencer L James, Simerjot K Jassal, Vivekanand Jha, Jost B Jonas, Farahnaz Joukar, Jacek Jerzy Jozwiak, Ali Kabir, Amaha Kahsay, Amir Kasaeian, Tesfaye Dessale Kassa, Hagazi Gebremedhin Kassaye, Yousef Saleh Khader, Rovshan Khalilov, Ejaz Ahmad Khan, Mohammad Saud Khan, Young-Ho Khang, Adnan Kisa, Csaba P Kovesdy, Barthelemy Kuate Defo, G Anil Kumar, Anders O Larsson, Lee-Ling Lim, Alan D Lopez, Paulo A Lotufo, Azeem Majeed, Reza Malekzadeh, Winfried März, Anthony Masaka, Hailemariam Abiy Alemu Meheretu, Tomasz Miazgowski, Andreea Mirica, Erkin M Mirrakhimov, Prasanna Mithra, Babak Moazen, Dara K Mohammad, Reza Mohammadpourhodki, Shafiu Mohammed, Ali H Mokdad, Linda Morales, Ilais Moreno Velasquez, Seyyed Meysam Mousavi, Satinath Mukhopadhyay, Jean B Nachega, Girish N Nadkarni, Jobert Richie Nansseu, Gopalakrishnan Natarajan, Javad Nazari, Bruce Neal, Ruxandra Irina Negoi, Cuong Tat Nguyen, Rajan Nikbakhsh, Jean Jacques Noubiap, Christoph Nowak, Andrew T Olagunju, Alberto Ortiz, Mayowa Ojo Owolabi",2020/2/29,The lancet,395,10225,709-733,Elsevier
"Max G Griswold, Nancy Fullman, Caitlin Hawley, Nicholas Arian, Stephanie RM Zimsen, Hayley D Tymeson, Vidhya Venkateswaran, Austin Douglas Tapp, Mohammad H Forouzanfar, Joseph S Salama, Kalkidan Hassen Abate, Degu Abate, Solomon M Abay, Cristiana Abbafati, Rizwan Suliankatchi Abdulkader, Zegeye Abebe, Victor Aboyans, Mohammed Mehdi Abrar, Pawan Acharya, Olatunji O Adetokunboh, Tara Ballav Adhikari, Jose C Adsuar, Mohsen Afarideh, Emilie Elisabet Agardh, Gina Agarwal, Sargis Aghasi Aghayan, Sutapa Agrawal, Muktar Beshir Ahmed, Mohammed Akibu, Tomi Akinyemiju, Nadia Akseer, Deena H Al Asfoor, Ziyad Al-Aly, Fares Alahdab, Khurshid Alam, Ammar Albujeer, Kefyalew Addis Alene, Raghib Ali, Syed Danish Ali, Mehran Alijanzadeh, Syed Mohamed Aljunid, Ala'a Alkerwi, Peter Allebeck, Nelson Alvis-Guzman, Azmeraw T Amare, Leopold N Aminde, Walid Ammar, Yaw Ampem Amoako, Gianna Gayle Herrera Amul, Catalina Liliana Andrei, Colin Angus, Mustafa Geleto Ansha, Carl Abelardo T Antonio, Olatunde Aremu, Johan Ärnlöv, Al Artaman, Krishna K Aryal, Reza Assadi, Marcel Ausloos, Leticia Avila-Burgos, Euripide F Avokpaho, Ashish Awasthi, Henok Tadesse Ayele, Rakesh Ayer, Tambe B Ayuk, Peter S Azzopardi, Hamid Badali, Alaa Badawi, Maciej Banach, Suzanne Lyn Barker-Collo, Lope H Barrero, Huda Basaleem, Estifanos Baye, Shahrzad Bazargan-Hejazi, Neeraj Bedi, Yannick Béjot, Abate Bekele Belachew, Saba Abraham Belay, Derrick A Bennett, Isabela M Bensenor, Eduardo Bernabe, Robert S Bernstein, Addisu Shunu Beyene, Tina Beyranvand, Soumyadeeep Bhaumik, Zulfiqar A Bhutta, Belete Biadgo, Ali Bijani, Nigus Bililign, Sait Mentes Birlik, Charles Birungi, Hailemichael Bizuneh, Peter Bjerregaard, Tone Bjørge, Guilherme Borges, Cristina Bosetti, Soufiane Boufous, Nicola Luigi Bragazzi, Hermann Brenner, Zahid A Butt, Lucero Cahuana-Hurtado, Bianca Calabria, Ismael R Campos-Nonato, Julio Cesar Campuzano, Giulia Carreras, Juan J Carrero, Félix Carvalho, Carlos A Castañeda-Orjuela, Jacqueline Castillo Rivas, Ferrán Catalá-López, Jung-Chen Chang, Fiona J Charlson, Aparajita Chattopadhyay, Pankaj Chaturvedi, Rajiv Chowdhury, Devasahayam J Christopher, Sheng-Chia Chung, Liliana G Ciobanu, Rafael M Claro, Sara Conti, Ewerton Cousin, Michael H Criqui, Berihun Assefa Dachew, Paul I Dargan, Ahmad Daryani, José Das Neves, Kairat Davletov, Filipa De Castro, Barbora De Courten, Jan-Walter De Neve, Louisa Degenhardt, Gebre Teklemariam Demoz, Don C Des Jarlais, Subhojit Dey, Rupinder Singh Dhaliwal, Samath Dhamminda Dharmaratne, Meghnath Dhimal, David Teye Doku, Kerrie E Doyle, Manisha Dubey, Eleonora Dubljanin, Bruce B Duncan, Hedyeh Ebrahimi, Dumessa Edessa, Maysaa El Sayed Zaki, Sergei Petrovich Ermakov, Holly E Erskine, Alireza Esteghamati, Mahbobeh Faramarzi, Andrea Farioli",2018/9/22,The Lancet,392,10152,1015-1035,Elsevier
"Catherine Owens Johnson, Minh Nguyen, Gregory A Roth, Emma Nichols, Tahiya Alam, Degu Abate, Foad Abd-Allah, Ahmed Abdelalim, Haftom Niguse Abraha, Niveen ME Abu-Rmeileh, Oladimeji M Adebayo, Abiodun Moshood Adeoye, Gina Agarwal, Sutapa Agrawal, Amani Nidhal Aichour, Ibtihel Aichour, Miloud Taki Eddine Aichour, Fares Alahdab, Raghib Ali, Nelson Alvis-Guzman, Nahla Hamed Anber, Mina Anjomshoa, Jalal Arabloo, Antonio Arauz, Johan Ärnlöv, Amit Arora, Ashish Awasthi, Maciej Banach, Miguel A Barboza, Suzanne Lyn Barker-Collo, Till Winfried Bärnighausen, Sanjay Basu, Abate Bekele Belachew, Yaschilal Muche Belayneh, Derrick A Bennett, Isabela M Bensenor, Krittika Bhattacharyya, Belete Biadgo, Ali Bijani, Boris Bikbov, Muhammad Shahdaat Bin Sayeed, Zahid A Butt, Lucero Cahuana-Hurtado, Juan J Carrero, Félix Carvalho, Carlos A Castañeda-Orjuela, Franz Castro, Ferrán Catalá-López, Yazan Chaiah, Peggy Pei-Chia Chiang, Jee-Young J Choi, Hanne Christensen, Dinh-Toi Chu, Monica Cortinovis, Albertino Antonio Moura Damasceno, Lalit Dandona, Rakhi Dandona, Ahmad Daryani, Kairat Davletov, Barbora De Courten, Vanessa De la Cruz-Góngora, Meaza Girma Degefa, Samath Dhamminda Dharmaratne, Daniel Diaz, Manisha Dubey, Eyasu Ejeta Duken, Dumessa Edessa, Matthias Endres, JOSE A FARAON, Farshad Farzadfar, Eduarda Fernandes, Florian Fischer, Luisa Sorio Flor, Morsaleh Ganji, Abadi Kahsu Gebre, Teklu Gebrehiwo Gebremichael, Birhanu Geta, Kebede Embaye Gezae, Paramjit Singh Gill, Elena V Gnedovskaya, Hector Gómez-Dantés, Alessandra C Goulart, Giuseppe Grosso, Yuming Guo, Rajeev Gupta, Arvin Haj-Mirzaian, Arya Haj-Mirzaian, Samer Hamidi, Graeme J Hankey, Hamid Yimam Hassen, Simon I Hay, Mohamed I Hegazy, Behnam Heidari, Nabeel A Herial, Mohammad Ali Hosseini, Sorin Hostiuc, Seyed Sina Naghibi Irvani, Sheikh Mohammed Shariful Islam, Nader Jahanmehr, Mehdi Javanbakht, Ravi Prakash Jha, Jost B Jonas, Jacek Jerzy Jozwiak, Mikk Jürisson, Amaha Kahsay, Rizwan Kalani, Yogeshwar Kalkonde, Teshome Abegaz Kamil, Tanuj Kanchan, André Karch, Narges Karimi, Hamidreza Karimi-Sari, Amir Kasaeian, Tesfaye Dessale Kassa, Hossein Kazemeini, Adane Teshome Kefale, Yousef Saleh Khader, Ibrahim A Khalil, Ejaz Ahmad Khan, Young-Ho Khang, Jagdish Khubchandani, Daniel Kim, Yun Jin Kim, Adnan Kisa, Mika Kivimäki, Ai Koyanagi, Rita K Krishnamurthi, G Anil Kumar, Alessandra Lafranconi, Sarah Lewington, Shanshan Li, Warren David Lo, Alan D Lopez, Stefan Lorkowski, Paulo A Lotufo, Mark T Mackay, Marek Majdan, Reza Majdzadeh, Azeem Majeed, Reza Malekzadeh, Navid Manafi, Mohammad Ali Mansournia, Man Mohan Mehndiratta, Varshil Mehta, Getnet Mengistu, Atte Meretoja, Tuomo J Meretoja, Bartosz Miazgowski, Tomasz Miazgowski, Ted R Miller",2019/5/1,The Lancet Neurology,18,5,439-458,Elsevier
"Hmwe Hmwe Kyu, Degu Abate, Kalkidan Hassen Abate, Solomon M Abay, Cristiana Abbafati, Nooshin Abbasi, Hedayat Abbastabar, Foad Abd-Allah, Jemal Abdela, Ahmed Abdelalim, Ibrahim Abdollahpour, Rizwan Suliankatchi Abdulkader, Molla Abebe, Zegeye Abebe, Olifan Zewdie Abil, Victor Aboyans, Aklilu Roba Abrham, Laith Jamal Abu-Raddad, Niveen ME Abu-Rmeileh, Manfred Mario Kokou Accrombessi, Dilaram Acharya, Pawan Acharya, Ilana N Ackerman, Abdu A Adamu, Oladimeji M Adebayo, Victor Adekanmbi, Zanfina Ademi, Olatunji O Adetokunboh, Mina G Adib, Jose C Adsuar, Kossivi Agbelenko Afanvi, Mohsen Afarideh, Ashkan Afshin, Gina Agarwal, Kareha M Agesa, Rakesh Aggarwal, Sargis Aghasi Aghayan, Anurag Agrawal, Alireza Ahmadi, Mehdi Ahmadi, Hamid Ahmadieh, Muktar Beshir Ahmed, Sayem Ahmed, Amani Nidhal Aichour, Ibtihel Aichour, Miloud Taki Eddine Aichour, Tomi Akinyemiju, Nadia Akseer, Ziyad Al-Aly, Ayman Al-Eyadhy, Hesham M Al-Mekhlafi, Rajaa M Al-Raddadi, Fares Alahdab, Khurshid Alam, Tahiya Alam, Alaa Alashi, Seyed Moayed Alavian, Kefyalew Addis Alene, Mehran Alijanzadeh, Reza Alizadeh-Navaei, Syed Mohamed Aljunid, Ala'a Alkerwi, Francois Alla, Peter Allebeck, Jordi Alonso, Ubai Alsharif, Khalid Altirkawi, Nelson Alvis-Guzman, Leopold N Aminde, Erfan Amini, Mohammadreza Amiresmaili, Walid Ammar, Yaw Ampem Amoako, Nahla Hamed Anber, Catalina Liliana Andrei, Sofia Androudi, Megbaru Debalkie Animut, Mina Anjomshoa, Mustafa Geleto Ansha, Carl Abelardo T Antonio, Palwasha Anwari, Jalal Arabloo, Olatunde Aremu, Johan Ärnlöv, Amit Arora, Megha Arora, Al Artaman, Krishna K Aryal, Hamid Asayesh, Zerihun Ataro, Marcel Ausloos, Leticia Avila-Burgos, Euripide FGA Avokpaho, Ashish Awasthi, Beatriz Paulina Ayala Quintanilla, Rakesh Ayer, Peter S Azzopardi, Arefeh Babazadeh, Hamid Badali, Kalpana Balakrishnan, Ayele Geleto Bali, Maciej Banach, Joseph Adel Mattar Banoub, Aleksandra Barac, Miguel A Barboza, Suzanne Lyn Barker-Collo, Till Winfried Bärnighausen, Simon Barquera, Lope H Barrero, Shahrzad Bazargan-Hejazi, Neeraj Bedi, Ettore Beghi, Masoud Behzadifar, Meysam Behzadifar, Bayu Begashaw Bekele, Eyasu Tamru Bekru, Abate Bekele Belachew, Yihalem Abebe Belay, Michelle L Bell, Aminu K Bello, Derrick A Bennett, Isabela M Bensenor, Adugnaw Berhane, Eduardo Bernabe, Robert S Bernstein, Mircea Beuran, Tina Beyranvand, Neeraj Bhala, Samir Bhatt, Soumyadeep Bhaumik, Zulfiqar A Bhutta, Belete Biadgo, Molly H Biehl, Ali Bijani, Boris Bikbov, Ver Bilano, Nigus Bililign, Muhammad Shahdaat Bin Sayeed, Donal Bisanzio, Tone Bjørge, Archie Bleyer, Eshetu Mulisa Bobasa, Ibrahim R Bou-Orm, Soufiane Boufous, Rupert Bourne, Oliver J Brady, Luisa C Brant, Carol Brayne, Alexandra Brazinova, Nicholas JK Breitborde",2018/11/10,The Lancet,392,10159,1859-1922,Elsevier
"Emma Nichols, Cassandra EI Szoeke, Stein Emil Vollset, Nooshin Abbasi, Foad Abd-Allah, Jemal Abdela, Miloud Taki Eddine Aichour, Rufus O Akinyemi, Fares Alahdab, Solomon W Asgedom, Ashish Awasthi, Suzanne L Barker-Collo, Bernhard T Baune, Yannick Béjot, Abate B Belachew, Derrick A Bennett, Belete Biadgo, Ali Bijani, Muhammad Shahdaat Bin Sayeed, Carol Brayne, David O Carpenter, Félix Carvalho, Ferrán Catalá-López, Ester Cerin, Jee-Young J Choi, Anh Kim Dang, Meaza G Degefa, Shirin Djalalinia, Manisha Dubey, Eyasu Ejeta Duken, David Edvardsson, Matthias Endres, Sharareh Eskandarieh, Andre Faro, Farshad Farzadfar, Seyed-Mohammad Fereshtehnejad, Eduarda Fernandes, Irina Filip, Florian Fischer, Abadi K Gebre, Demeke Geremew, Maryam Ghasemi-Kasman, Elena V Gnedovskaya, Rajeev Gupta, Vladimir Hachinski, Tekleberhan B Hagos, Samer Hamidi, Graeme J Hankey, Josep M Haro, Simon I Hay, Seyed Sina N Irvani, Ravi P Jha, Jost B Jonas, Rizwan Kalani, André Karch, Amir Kasaeian, Yousef Saleh Khader, Ibrahim A Khalil, Ejaz Ahmad Khan, Tripti Khanna, Tawfik AM Khoja, Jagdish Khubchandani, Adnan Kisa, Katarzyna Kissimova-Skarbek, Mika Kivimäki, Ai Koyanagi, Kristopher J Krohn, Giancarlo Logroscino, Stefan Lorkowski, Marek Majdan, Reza Malekzadeh, Winfried März, João Massano, Getnet Mengistu, Atte Meretoja, Moslem Mohammadi, Maryam Mohammadi-Khanaposhtani, Ali H Mokdad, Stefania Mondello, Ghobad Moradi, Gabriele Nagel, Mohsen Naghavi, Gurudatta Naik, Long H Nguyen, Trang H Nguyen, Yirga L Nirayo, Molly R Nixon, Richard Ofori-Asenso, Felix A Ogbo, Andrew T Olagunju, Mayowa O Owolabi, Songhomitra Panda-Jonas, Valéria M de Azeredo Passos, David M Pereira, Gabriel D Pinilla-Monsalve, Michael A Piradov, Constance D Pond, Hossein Poustchi, Mostafa Qorbani, Amir Radfar, Robert C Reiner, Stephen R Robinson, Gholamreza Roshandel, Ali Rostami, Tom C Russ, Perminder S Sachdev, Hosein Safari, Saeid Safiri, Ramesh Sahathevan, Yahya Salimi, Maheswar Satpathy, Monika Sawhney, Mete Saylan, Sadaf G Sepanlou, Azadeh Shafieesabet, Masood A Shaikh, Mohammad Ali Sahraian, Mika Shigematsu, Rahman Shiri, Ivy Shiue, João P Silva, Mari Smith, Soheila Sobhani, Dan J Stein, Rafael Tabarés-Seisdedos, Marcos R Tovani-Palone, Bach X Tran, Tung Thanh Tran, Amanuel T Tsegay, Irfan Ullah, Narayanaswamy Venketasubramanian, Vasily Vlassov, Yuan-Pang Wang, Jordan Weiss, Ronny Westerman, Tissa Wijeratne, Grant MA Wyper, Yuichiro Yano, Ebrahim M Yimer, Naohiro Yonemoto, Mahmoud Yousefifard, Zoubida Zaidi, Zohreh Zare, Theo Vos, Valery L Feigin, Christopher JL Murray",2019/1/1,The Lancet Neurology,18,1,88-106,Elsevier
"Simon I Hay, Amanuel Alemu Abajobir, Kalkidan Hassen Abate, Cristiana Abbafati, Kaja M Abbas, Foad Abd-Allah, Rizwan Suliankatchi Abdulkader, Abdishakur M Abdulle, Teshome Abuka Abebo, Semaw Ferede Abera, Victor Aboyans, Laith J Abu-Raddad, Ilana N Ackerman, Isaac A Adedeji, Olatunji Adetokunboh, Ashkan Afshin, Rakesh Aggarwal, Sutapa Agrawal, Anurag Agrawal, Muktar Beshir Ahmed, Miloud Taki Eddine Aichour, Amani Nidhal Aichour, Ibtihel Aichour, Sneha Aiyar, Tomi F Akinyemiju, Nadia Akseer, Faris Hasan Al Lami, Fares Alahdab, Ziyad Al-Aly, Khurshid Alam, Noore Alam, Tahiya Alam, Deena Alasfoor, Kefyalew Addis Alene, Raghib Ali, Reza Alizadeh-Navaei, Juma M Alkaabi, Ala'a Alkerwi, François Alla, Peter Allebeck, Christine Allen, Fatma Al-Maskari, Mohammad AbdulAziz AlMazroa, Rajaa Al-Raddadi, Ubai Alsharif, Shirina Alsowaidi, Benjamin M Althouse, Khalid A Altirkawi, Nelson Alvis-Guzman, Azmeraw T Amare, Erfan Amini, Walid Ammar, Yaw Ampem Amoako, Mustafa Geleto Ansha, Carl Abelardo T Antonio, Palwasha Anwari, Johan Ärnlöv, Megha Arora, Al Artaman, Krishna Kumar Aryal, Solomon W Asgedom, Tesfay Mehari Atey, Niguse Tadele Atnafu, Leticia Avila-Burgos, Euripide Frinel G Arthur Avokpaho, Ashish Awasthi, Shally Awasthi, Mahmoud Reza Azarpazhooh, Peter Azzopardi, Tesleem Kayode Babalola, Umar Bacha, Alaa Badawi, Kalpana Balakrishnan, Marlena S Bannick, Aleksandra Barac, Suzanne L Barker-Collo, Till Bärnighausen, Simon Barquera, Lope H Barrero, Sanjay Basu, Robert Battista, Katherine E Battle, Bernhard T Baune, Shahrzad Bazargan-Hejazi, Justin Beardsley, Neeraj Bedi, Yannick Béjot, Bayu Begashaw Bekele, Michelle L Bell, Derrick A Bennett, James R Bennett, Isabela M Bensenor, Jennifer Benson, Adugnaw Berhane, Derbew Fikadu Berhe, Eduardo Bernabé, Balem Demtsu Betsu, Mircea Beuran, Addisu Shunu Beyene, Anil Bhansali, Samir Bhatt, Zulfiqar A Bhutta, Sibhatu Biadgilign, Burcu Kucuk Bicer, Kelly Bienhoff, Boris Bikbov, Charles Birungi, Stan Biryukov, Donal Bisanzio, Habtamu Mellie Bizuayehu, Fiona M Blyth, Dube Jara Boneya, Dipan Bose, Ibrahim R Bou-Orm, Rupert RA Bourne, Michael Brainin, Carol Brayne, Alexandra Brazinova, Nicholas JK Breitborde, Paul S Briant, Gabrielle Britton, Traolach S Brugha, Rachelle Buchbinder, Lemma Negesa Bulto Bulto, Blair R Bumgarner, Zahid A Butt, Lucero Cahuana-Hurtado, Ewan Cameron, Ismael Ricardo Campos-Nonato, Hélène Carabin, Rosario Cárdenas, David O Carpenter, Juan Jesus Carrero, Austin Carter, Felix Carvalho, Daniel Casey, Carlos A Castañeda-Orjuela, Chris D Castle, Ferrán Catalá-López, Jung-Chen Chang, Fiona J Charlson, Pankaj Chaturvedi, Honglei Chen, Mirriam Chibalabala, Chioma Ezinne Chibueze, Vesper Hichilombwe Chisumpa, Abdulaal A Chitheer, Rajiv Chowdhury, Devasahayam Jesudas Christopher, Liliana G Ciobanu",2017/9/16,The Lancet,390,10100,1260-1344,Elsevier
"Valery L Feigin, Benjamin A Stark, Catherine Owens Johnson, Gregory A Roth, Catherine Bisignano, Gdiom Gebreheat Abady, Mitra Abbasifard, Mohsen Abbasi-Kangevari, Foad Abd-Allah, Vida Abedi, Ahmed Abualhasan, Niveen Me Abu-Rmeileh, Abdelrahman I Abushouk, Oladimeji M Adebayo, Gina Agarwal, Pradyumna Agasthi, Bright Opoku Ahinkorah, Sohail Ahmad, Sepideh Ahmadi, Yusra Ahmed Salih, Budi Aji, Samaneh Akbarpour, Rufus Olusola Akinyemi, Hanadi Al Hamad, Fares Alahdab, Sheikh Mohammad Alif, Vahid Alipour, Syed Mohamed Aljunid, Sami Almustanyir, Rajaa M Al-Raddadi, Rustam Al-Shahi Salman, Nelson Alvis-Guzman, Robert Ancuceanu, Deanna Anderlini, Jason A Anderson, Adnan Ansar, Ippazio Cosimo Antonazzo, Jalal Arabloo, Johan Ärnlöv, Kurnia Dwi Artanti, Zahra Aryan, Samaneh Asgari, Tahira Ashraf, Mohammad Athar, Alok Atreya, Marcel Ausloos, Atif Amin Baig, Ovidiu Constantin Baltatu, Maciej Banach, Miguel A Barboza, Suzanne Lyn Barker-Collo, Till Winfried Bärnighausen, Mark Thomaz Ugliara Barone, Sanjay Basu, Gholamreza Bazmandegan, Ettore Beghi, Mahya Beheshti, Yannick Bejot, Arielle Wilder Bell, Derrick A Bennett, Isabela M Bensenor, Woldesellassie Mequanint Bezabhe, Yihienew Mequanint Bezabih, Akshaya Srikanth Bhagavathula, Pankaj Bhardwaj, Krittika Bhattacharyya, Ali Bijani, Boris Bikbov, Mulugeta M Birhanu, Archith Boloor, Aime Bonny, Michael Brauer, Hermann Brenner, Dana Bryazka, Zahid A Butt, Florentino Luciano Caetano Dos Santos, Ismael R Campos-Nonato, Carlos Cantu-Brito, Juan J Carrero, Carlos A Castaneda-Orjuela, Alberico L Catapano, Promit Ananyo Chakraborty, Jaykaran Charan, Sonali Gajanan Choudhari, Enayet Karim Chowdhury, Dinh-Toi Chu, Sheng-Chia Chung, David Colozza, Vera Marisa Costa, Simona Costanzo, Michael H Criqui, Omid Dadras, Baye Dagnew, Xiaochen Dai, Koustuv Dalal, Albertino Antonio Moura Damasceno, Emanuele D'amico, Lalit Dandona, Rakhi Dandona, Jiregna Darega Gela, Kairat Davletov, Vanessa De La Cruz-Gongora, Rupak Desai, Deepak Dhamnetiya, Samath Dhamminda Dharmaratne, Mandira Lamichhane Dhimal, Meghnath Dhimal, Daniel Diaz, Martin Dichgans, Klara Dokova, Rajkumar Doshi, Abdel Douiri, Bruce B Duncan, Sahar Eftekharzadeh, Michael Ekholuenetale, Nevine El Nahas, Islam Y Elgendy, Muhammed Elhadi, Shaimaa I El-Jaafary, Matthias Endres, Aman Yesuf Endries, Daniel Asfaw Erku, Jose A Faraon, Umar Farooque, Farshad Farzadfar, Abdullah Hamid Feroze, Irina Filip, Florian Fischer, David Flood, Mohamed M Gad, Shilpa Gaidhane, Reza Ghanei Gheshlagh, Ahmad Ghashghaee, Nermin Ghith, Ghozali Ghozali, Sherief Ghozy, Alessandro Gialluisi, Simona Giampaoli, Syed Amir Gilani, Paramjit Singh Gill, Elena V Gnedovskaya, Mahaveer Golechha, Alessandra C Goulart, Yuming Guo, Rajeev Gupta, Veer Bala Gupta, Vivek Kumar Gupta, Pradip Gyanwali, Nima Hafezi-Nejad, Samer Hamidi",2021/10/1,The Lancet Neurology,20,10,795-820,Elsevier
"Christopher Troeger, Brigette F Blacker, Ibrahim A Khalil, Puja C Rao, Shujin Cao, Stephanie RM Zimsen, Samuel B Albertson, Jeffery D Stanaway, Aniruddha Deshpande, Zegeye Abebe, Nelson Alvis-Guzman, Azmeraw T Amare, Solomon W Asgedom, Zelalem Alamrew Anteneh, Carl Abelardo T Antonio, Olatunde Aremu, Ephrem Tsegay Asfaw, Tesfay Mehari Atey, Suleman Atique, Euripide Frinel G Arthur Avokpaho, Ashish Awasthi, Henok Tadesse Ayele, Aleksandra Barac, Mauricio L Barreto, Quique Bassat, Saba Abraham Belay, Isabela M Bensenor, Zulfiqar A Bhutta, Ali Bijani, Hailemichael Bizuneh, Carlos A Castañeda-Orjuela, Abel Fekadu Dadi, Lalit Dandona, Rakhi Dandona, Huyen Phuc Do, Manisha Dubey, Eleonora Dubljanin, Dumessa Edessa, Aman Yesuf Endries, Babak Eshrati, Tamer Farag, Garumma Tolu Feyissa, Kyle J Foreman, Mohammad H Forouzanfar, Nancy Fullman, Peter W Gething, Melkamu Dedefo Gishu, William W Godwin, Harish Chander Gugnani, Rahul Gupta, Gessessew Bugssa Hailu, Hamid Yimam Hassen, Desalegn Tsegaw Hibstu, Olayinka S Ilesanmi, Jost B Jonas, Amaha Kahsay, Gagandeep Kang, Amir Kasaeian, Yousef Saleh Khader, Ejaz Ahmad Khan, Muhammad Ali Khan, Young-Ho Khang, Niranjan Kissoon, Sonali Kochhar, Karen L Kotloff, Ai Koyanagi, G Anil Kumar, Hassan Magdy Abd El Razek, Reza Malekzadeh, Deborah Carvalho Malta, Suresh Mehata, Walter Mendoza, Desalegn Tadese Mengistu, Bereket Gebremichael Menota, Haftay Berhane Mezgebe, Fitsum Weldegebreal Mlashu, Srinivas Murthy, Gurudatta A Naik, Cuong Tat Nguyen, Trang Huyen Nguyen, Dina Nur Anggraini Ningrum, Felix Akpojene Ogbo, Andrew Toyin Olagunju, Deepak Paudel, James A Platts-Mills, Mostafa Qorbani, Anwar Rafay, Rajesh Kumar Rai, Saleem M Rana, Chhabi Lal Ranabhat, Davide Rasella, Sarah E Ray, Cesar Reis, Andre MN Renzaho, Mohammad Sadegh Rezai, George Mugambage Ruhago, Saeid Safiri, Joshua A Salomon, Juan Ramon Sanabria, Benn Sartorius, Monika Sawhney, Sadaf G Sepanlou, Mika Shigematsu, Mekonnen Sisay, Ranjani Somayaji, Chandrashekhar T Sreeramareddy, Bryan L Sykes, Getachew Redae Taffere, Roman Topor-Madry, Bach Xuan Tran, Kald Beshir Tuem, Kingsley Nnanna Ukwaja, Stein Emil Vollset, Judd L Walson, Marcia R Weaver, Kidu Gidey Weldegwergs, Andrea Werdecker, Abdulhalik Workicho, Muluken Yenesew, Biruck Desalegn Yirsaw, Naohiro Yonemoto, Maysaa El Sayed Zaki, Theo Vos, Stephen S Lim, Mohsen Naghavi, Christopher JL Murray, Ali H Mokdad, Simon I Hay, Robert C Reiner",2018/11/1,The Lancet Infectious Diseases,18,11,1211-1228,Elsevier
